{
  "brokenSymlinks": [],
  "counts": {
    "brokenSymlinks": 0,
    "byBucket": {
      "authored-local": 87,
      "backup": 33,
      "canonical": 56,
      "installed-marketplace": 608,
      "runtime": 37,
      "runtime-alias": 48
    },
    "byBucketAndType": {
      "authored-local": {
        "AGENT": 37,
        "HOOK": 10,
        "INSTRUCTION": 3,
        "PLUGIN": 2,
        "SKILL": 35
      },
      "backup": {
        "AGENT": 8,
        "SKILL": 25
      },
      "canonical": {
        "AGENT": 5,
        "HOOK": 10,
        "INSTRUCTION": 8,
        "PLUGIN": 11,
        "SKILL": 22
      },
      "installed-marketplace": {
        "AGENT": 231,
        "HOOK": 22,
        "INSTRUCTION": 1,
        "PLUGIN": 131,
        "SKILL": 223
      },
      "runtime": {
        "AGENT": 13,
        "SKILL": 24
      },
      "runtime-alias": {
        "AGENT": 5,
        "INSTRUCTION": 1,
        "SKILL": 42
      }
    },
    "byType": {
      "AGENT": 299,
      "HOOK": 42,
      "INSTRUCTION": 13,
      "PLUGIN": 144,
      "SKILL": 371
    },
    "digestReviewGroups": 15,
    "firstPartyDigestMatches": 0,
    "firstPartyNameCollisions": 0,
    "nameReviewGroups": 50,
    "totalEntries": 869
  },
  "digestReviewQueue": [
    {
      "action": "REPLACE_DUPLICATES_WITH_REFERENCES_AFTER_REVIEW",
      "buckets": [
        "authored-local",
        "runtime"
      ],
      "entries": [
        {
          "bucket": "authored-local",
          "name": "openai",
          "path": "jira-resolve-ticket/agents/openai.yaml",
          "resolvedPath": "/Users/amichne/code/apollo/skills/jira-resolve-ticket/agents/openai.yaml",
          "sha256": "sha256:03f8f25b25be6267c15f42a87c15caf54fe0863d40ebf90104c4a44e93a1864c",
          "sourceRoot": "apollo-skills",
          "type": "AGENT"
        },
        {
          "bucket": "runtime",
          "name": "openai",
          "path": "jira-resolve-ticket/agents/openai.yaml",
          "resolvedPath": "/Users/amichne/code/apollo/skills/jira-resolve-ticket/agents/openai.yaml",
          "sha256": "sha256:03f8f25b25be6267c15f42a87c15caf54fe0863d40ebf90104c4a44e93a1864c",
          "sourceRoot": "global-codex-skills",
          "type": "AGENT"
        }
      ],
      "priority": 2,
      "sha256": "sha256:03f8f25b25be6267c15f42a87c15caf54fe0863d40ebf90104c4a44e93a1864c"
    },
    {
      "action": "REPLACE_DUPLICATES_WITH_REFERENCES_AFTER_REVIEW",
      "buckets": [
        "authored-local",
        "backup",
        "runtime"
      ],
      "entries": [
        {
          "bucket": "authored-local",
          "name": "skill-creator",
          "path": ".system/skill-creator",
          "resolvedPath": "/Users/amichne/code/apollo/skills/.system/skill-creator/SKILL.md",
          "sha256": "sha256:104b792090370aff47c4a70411cb84e737b7cfa9699f2f54c916d8946fc98f16",
          "sourceRoot": "apollo-skills",
          "type": "SKILL"
        },
        {
          "bucket": "backup",
          "name": "skill-creator",
          "path": ".system/skill-creator",
          "resolvedPath": "/Users/amichne/.codex/skills.backup/.system/skill-creator/SKILL.md",
          "sha256": "sha256:104b792090370aff47c4a70411cb84e737b7cfa9699f2f54c916d8946fc98f16",
          "sourceRoot": "global-codex-skills-backup",
          "type": "SKILL"
        },
        {
          "bucket": "runtime",
          "name": "skill-creator",
          "path": ".system/skill-creator",
          "resolvedPath": "/Users/amichne/.agents/skills/.system/skill-creator/SKILL.md",
          "sha256": "sha256:104b792090370aff47c4a70411cb84e737b7cfa9699f2f54c916d8946fc98f16",
          "sourceRoot": "global-agent-skills",
          "type": "SKILL"
        },
        {
          "bucket": "runtime",
          "name": "skill-creator",
          "path": ".system/skill-creator",
          "resolvedPath": "/Users/amichne/code/apollo/skills/.system/skill-creator/SKILL.md",
          "sha256": "sha256:104b792090370aff47c4a70411cb84e737b7cfa9699f2f54c916d8946fc98f16",
          "sourceRoot": "global-codex-skills",
          "type": "SKILL"
        }
      ],
      "priority": 2,
      "sha256": "sha256:104b792090370aff47c4a70411cb84e737b7cfa9699f2f54c916d8946fc98f16"
    },
    {
      "action": "REPLACE_DUPLICATES_WITH_REFERENCES_AFTER_REVIEW",
      "buckets": [
        "authored-local",
        "runtime"
      ],
      "entries": [
        {
          "bucket": "authored-local",
          "name": "imagegen",
          "path": ".system/imagegen",
          "resolvedPath": "/Users/amichne/code/apollo/skills/.system/imagegen/SKILL.md",
          "sha256": "sha256:3555f7bdb3a50a4ccb99be8d94d23528509b988f3f72645e03705da25594b66c",
          "sourceRoot": "apollo-skills",
          "type": "SKILL"
        },
        {
          "bucket": "runtime",
          "name": "imagegen",
          "path": ".system/imagegen",
          "resolvedPath": "/Users/amichne/code/apollo/skills/.system/imagegen/SKILL.md",
          "sha256": "sha256:3555f7bdb3a50a4ccb99be8d94d23528509b988f3f72645e03705da25594b66c",
          "sourceRoot": "global-codex-skills",
          "type": "SKILL"
        }
      ],
      "priority": 2,
      "sha256": "sha256:3555f7bdb3a50a4ccb99be8d94d23528509b988f3f72645e03705da25594b66c"
    },
    {
      "action": "REPLACE_DUPLICATES_WITH_REFERENCES_AFTER_REVIEW",
      "buckets": [
        "authored-local",
        "installed-marketplace",
        "runtime"
      ],
      "entries": [
        {
          "bucket": "authored-local",
          "name": "grader",
          "path": "skill-creator/agents/grader.md",
          "resolvedPath": "/Users/amichne/code/kast/.agents/skills/skill-creator/agents/grader.md",
          "sha256": "sha256:57134da0c1a4eea33fbd74a1c9c44aa814f07d6bc64de303edb586f941e5d21a",
          "sourceRoot": "kast-agent-skills",
          "type": "AGENT"
        },
        {
          "bucket": "installed-marketplace",
          "name": "grader",
          "path": "cache/claude-plugins-official/skill-creator/unknown/skills/skill-creator/agents/grader.md",
          "resolvedPath": "/Users/amichne/.claude/plugins/cache/claude-plugins-official/skill-creator/unknown/skills/skill-creator/agents/grader.md",
          "sha256": "sha256:57134da0c1a4eea33fbd74a1c9c44aa814f07d6bc64de303edb586f941e5d21a",
          "sourceRoot": "claude-plugins",
          "type": "AGENT"
        },
        {
          "bucket": "installed-marketplace",
          "name": "grader",
          "path": "marketplaces/anthropic-agent-skills/skills/skill-creator/agents/grader.md",
          "resolvedPath": "/Users/amichne/.claude/plugins/marketplaces/anthropic-agent-skills/skills/skill-creator/agents/grader.md",
          "sha256": "sha256:57134da0c1a4eea33fbd74a1c9c44aa814f07d6bc64de303edb586f941e5d21a",
          "sourceRoot": "claude-plugins",
          "type": "AGENT"
        },
        {
          "bucket": "installed-marketplace",
          "name": "grader",
          "path": "marketplaces/claude-plugins-official/plugins/skill-creator/skills/skill-creator/agents/grader.md",
          "resolvedPath": "/Users/amichne/.claude/plugins/marketplaces/claude-plugins-official/plugins/skill-creator/skills/skill-creator/agents/grader.md",
          "sha256": "sha256:57134da0c1a4eea33fbd74a1c9c44aa814f07d6bc64de303edb586f941e5d21a",
          "sourceRoot": "claude-plugins",
          "type": "AGENT"
        },
        {
          "bucket": "runtime",
          "name": "grader",
          "path": "skill-creator/agents/grader.md",
          "resolvedPath": "/Users/amichne/.agents/skills/skill-creator/agents/grader.md",
          "sha256": "sha256:57134da0c1a4eea33fbd74a1c9c44aa814f07d6bc64de303edb586f941e5d21a",
          "sourceRoot": "global-agent-skills",
          "type": "AGENT"
        }
      ],
      "priority": 2,
      "sha256": "sha256:57134da0c1a4eea33fbd74a1c9c44aa814f07d6bc64de303edb586f941e5d21a"
    },
    {
      "action": "REPLACE_DUPLICATES_WITH_REFERENCES_AFTER_REVIEW",
      "buckets": [
        "authored-local",
        "runtime"
      ],
      "entries": [
        {
          "bucket": "authored-local",
          "name": "openai",
          "path": ".system/openai-docs/agents/openai.yaml",
          "resolvedPath": "/Users/amichne/code/apollo/skills/.system/openai-docs/agents/openai.yaml",
          "sha256": "sha256:580081dd6c0896d72307d1f1b90d2248a64b9353bc546fdbf05ddeb3848e8c39",
          "sourceRoot": "apollo-skills",
          "type": "AGENT"
        },
        {
          "bucket": "runtime",
          "name": "openai",
          "path": ".system/openai-docs/agents/openai.yaml",
          "resolvedPath": "/Users/amichne/code/apollo/skills/.system/openai-docs/agents/openai.yaml",
          "sha256": "sha256:580081dd6c0896d72307d1f1b90d2248a64b9353bc546fdbf05ddeb3848e8c39",
          "sourceRoot": "global-codex-skills",
          "type": "AGENT"
        }
      ],
      "priority": 2,
      "sha256": "sha256:580081dd6c0896d72307d1f1b90d2248a64b9353bc546fdbf05ddeb3848e8c39"
    },
    {
      "action": "REPLACE_DUPLICATES_WITH_REFERENCES_AFTER_REVIEW",
      "buckets": [
        "authored-local",
        "backup",
        "runtime"
      ],
      "entries": [
        {
          "bucket": "authored-local",
          "name": "openai",
          "path": ".system/skill-installer/agents/openai.yaml",
          "resolvedPath": "/Users/amichne/code/apollo/skills/.system/skill-installer/agents/openai.yaml",
          "sha256": "sha256:5ce223d8b1070b82c42298538f1b8d376f788eb9e7a42a987e8c094070d73f0e",
          "sourceRoot": "apollo-skills",
          "type": "AGENT"
        },
        {
          "bucket": "backup",
          "name": "openai",
          "path": ".system/skill-installer/agents/openai.yaml",
          "resolvedPath": "/Users/amichne/.codex/skills.backup/.system/skill-installer/agents/openai.yaml",
          "sha256": "sha256:5ce223d8b1070b82c42298538f1b8d376f788eb9e7a42a987e8c094070d73f0e",